{
  "company": "Gotion High-Tech Co., Ltd.",
  "ticker": "002074.SZ",
  "currency": "CNY",
  "reporting_period": "2025",
  "schema": {"profile": "CAS_2019", "standard": "Chinese Accounting Standards for Business Enterprises (CAS)", "presentation_standard": "2019 consolidated financial statement format (会合01表)", "statement_type": "balance_sheet", "statement_scope": "consolidated", "jurisdiction": "China", "monetary_unit": "CNY", "amount_scale": "1", "presentation_basis": "current_non_current"},
  "source": {"statement": "Consolidated balance sheet", "as_of": "2025-12-31", "basis": "Closing balances in CNY; audited", "report": "Gotion High-Tech Co., Ltd. 2025 Annual Report", "url": "https://static.cninfo.com.cn/finalpage/2026-04-29/1225241936.PDF"},
  "assets": {
    "current": [
      {"name": "Cash and cash equivalents", "amount": "16813185998.06", "source_field": "货币资金", "description": "Source field 货币资金; cash, bank deposits, and other monetary balances."},
      {"name": "Trading financial assets", "amount": "2150889376.39", "source_field": "交易性金融资产", "description": "Source field 交易性金融资产; financial assets held for trading or measured through profit or loss."},
      {"name": "Notes receivable", "amount": "3240804795.42", "source_field": "应收票据", "description": "Source field 应收票据; commercial and bank acceptance notes receivable."},
      {"name": "Accounts receivable", "amount": "16300297490.16", "source_field": "应收账款", "description": "Source field 应收账款; trade receivables from customers."},
      {"name": "Receivables financing", "amount": "1375348839.80", "source_field": "应收款项融资", "description": "Source field 应收款项融资; receivables managed for collection and transfer."},
      {"name": "Prepayments", "amount": "252483940.54", "source_field": "预付款项", "description": "Source field 预付款项; amounts paid before goods or services are received."},
      {"name": "Other receivables", "amount": "312830011.18", "source_field": "其他应收款", "description": "Source field 其他应收款; non-trade receivables not separately presented."},
      {"name": "Inventory", "amount": "9690157206.01", "source_field": "存货", "description": "Source field 存货; materials, work in progress, and finished goods."},
      {"name": "Non-current assets due within one year", "amount": "88413876.61", "source_field": "一年内到期的非流动资产", "description": "Source field 一年内到期的非流动资产; non-current assets due within twelve months."},
      {"name": "Other current assets", "amount": "3706608709.50", "source_field": "其他流动资产", "description": "Source field 其他流动资产; current assets not presented elsewhere."}
    ],
    "non_current": [
      {"name": "Debt investments", "amount": "60000000.00", "source_field": "其他债权投资", "description": "Source field 其他债权投资; non-current debt instruments mapped to the canonical debt-investment indicator."},
      {"name": "Long-term investments", "amount": "1807750113.80", "source_field": "长期股权投资", "description": "Source field 长期股权投资; long-term equity-accounted investments."},
      {"name": "Equity investments", "amount": "1503215887.75", "source_field": "其他权益工具投资", "description": "Source field 其他权益工具投资; non-current investments in other equity instruments."},
      {"name": "Other non-current financial assets", "amount": "3358886392.90", "source_field": "其他非流动金融资产", "description": "Source field 其他非流动金融资产; company-reported financial assets preserved as an additional indicator."},
      {"name": "Fixed assets", "amount": "42506540834.94", "source_field": "固定资产", "description": "Source field 固定资产; property, plant, and equipment used in operations."},
      {"name": "Construction in progress", "amount": "12676514992.83", "source_field": "在建工程", "description": "Source field 在建工程; projects and equipment not yet ready for use."},
      {"name": "Right-of-use assets", "amount": "177749724.62", "source_field": "使用权资产", "description": "Source field 使用权资产; recognized rights to use leased assets."},
      {"name": "Intangible assets", "amount": "6758523753.47", "source_field": "无形资产", "description": "Source field 无形资产; identifiable non-monetary assets without physical substance."},
      {"name": "Development expenditure", "amount": "485566283.80", "source_field": "开发支出", "description": "Source field 开发支出; qualifying development expenditure capitalized before transfer."},
      {"name": "Goodwill", "amount": "382697712.65", "source_field": "商誉", "description": "Source field 商誉; acquisition goodwill remaining after impairment."},
      {"name": "Long-term deferred expenses", "amount": "146714681.09", "source_field": "长期待摊费用", "description": "Source field 长期待摊费用; deferred expenses preserved as an additional non-current indicator."},
      {"name": "Deferred tax assets", "amount": "1808365715.37", "source_field": "递延所得税资产", "description": "Source field 递延所得税资产; future tax benefits from deductible temporary differences."},
      {"name": "Other non-current assets", "amount": "1610973401.73", "source_field": "其他非流动资产", "description": "Source field 其他非流动资产; non-current assets not presented elsewhere."}
    ]
  },
  "liabilities": {
    "current": [
      {"name": "Short-term debt", "amount": "19649635531.29", "source_field": "短期借款", "description": "Source field 短期借款; borrowings due within twelve months."},
      {"name": "Derivative financial liabilities", "amount": "147993845.05", "source_field": "衍生金融负债", "description": "Source field 衍生金融负债; company-reported derivative obligations preserved as an additional indicator."},
      {"name": "Notes payable", "amount": "12639869777.39", "source_field": "应付票据", "description": "Source field 应付票据; commercial and bank acceptance notes payable."},
      {"name": "Accounts payable", "amount": "19149085027.49", "source_field": "应付账款", "description": "Source field 应付账款; trade amounts owed to suppliers."},
      {"name": "Deferred revenue", "amount": "697056960.78", "source_field": "合同负债", "description": "Source field 合同负债; customer consideration received before performance obligations are satisfied."},
      {"name": "Payroll payable", "amount": "628314507.74", "source_field": "应付职工薪酬", "description": "Source field 应付职工薪酬; accrued employee compensation and benefits."},
      {"name": "Taxes payable", "amount": "351888281.73", "source_field": "应交税费", "description": "Source field 应交税费; taxes and statutory charges accrued but unpaid."},
      {"name": "Other payables", "amount": "2071721820.47", "source_field": "其他应付款", "description": "Source field 其他应付款; company-reported miscellaneous payables preserved as an additional indicator."},
      {"name": "Non-current liabilities due within one year", "amount": "8910703760.81", "source_field": "一年内到期的非流动负债", "description": "Source field 一年内到期的非流动负债; current portion of long-term obligations."},
      {"name": "Other current liabilities", "amount": "2087430040.15", "source_field": "其他流动负债", "description": "Source field 其他流动负债; current obligations not presented elsewhere."}
    ],
    "non_current": [
      {"name": "Long-term debt", "amount": "19252155837.43", "source_field": "长期借款", "description": "Source field 长期借款; borrowings due after twelve months."},
      {"name": "Bonds payable", "amount": "600000000.00", "source_field": "应付债券", "description": "Source field 应付债券; issued bonds preserved as an additional non-current indicator."},
      {"name": "Lease liabilities", "amount": "117886403.18", "source_field": "租赁负债", "description": "Source field 租赁负债; non-current unpaid lease obligations."},
      {"name": "Long-term payables", "amount": "1981440445.99", "source_field": "长期应付款", "description": "Source field 长期应付款; company-reported long-term payables preserved as an additional indicator."},
      {"name": "Provisions", "amount": "845261791.66", "source_field": "预计负债", "description": "Source field 预计负债; obligations of uncertain timing or amount."},
      {"name": "Deferred income", "amount": "461772338.89", "source_field": "递延收益", "description": "Source field 递延收益; grants and other income recognized over future periods."},
      {"name": "Deferred tax liabilities", "amount": "715952297.64", "source_field": "递延所得税负债", "description": "Source field 递延所得税负债; future tax obligations from taxable temporary differences."}
    ]
  },
  "equity": {"items": [
    {"name": "Share capital", "amount": "1814113804.00", "source_field": "股本", "description": "Source field 股本; issued registered share capital."},
    {"name": "Capital reserve", "amount": "20800328907.52", "source_field": "资本公积", "description": "Source field 资本公积; share premium and other capital contributions."},
    {"name": "Treasury shares", "amount": "441086989.87", "source_field": "减：库存股", "description": "Source field 减：库存股; reported positive amount is treated as a deduction from equity.", "is_deduction": true},
    {"name": "Other comprehensive income", "amount": "-953750743.92", "source_field": "其他综合收益", "description": "Source field 其他综合收益; accumulated gains and losses recognized outside profit or loss."},
    {"name": "Special reserve", "amount": "7462535.46", "source_field": "专项储备", "description": "Source field 专项储备; statutory or industry-specific reserve."},
    {"name": "Surplus reserve", "amount": "243180156.10", "source_field": "盈余公积", "description": "Source field 盈余公积; appropriations from profit retained as a reserve."},
    {"name": "Retained earnings", "amount": "7653665982.85", "source_field": "未分配利润", "description": "Source field 未分配利润; cumulative profit retained after distributions and appropriations."},
    {"name": "Non-controlling interests", "amount": "7782437418.79", "source_field": "少数股东权益", "description": "Source field 少数股东权益; subsidiary equity attributable to shareholders outside the parent group."}
  ]}
}
