{
  "company": "Example Manufacturing Co., Ltd.",
  "ticker": "EXM",
  "reporting_period": "2024",
  "currency": "USD",
  "schema": {
    "profile": "CAS_2019",
    "standard": "Chinese Accounting Standards for Business Enterprises",
    "presentation_standard": "2019 consolidated financial statement format",
    "statement_type": "balance_sheet",
    "statement_scope": "consolidated",
    "jurisdiction": "China",
    "monetary_unit": "USD",
    "amount_scale": "1",
    "presentation_basis": "current_non_current"
  },
  "source": {
    "statement": "Consolidated balance sheet",
    "as_of": "2024-12-31",
    "report": "Example Manufacturing 2024 illustrative annual report",
    "url": "https://example.com/reports/example-manufacturing-2024"
  },
  "assets": {
    "current": [
      {"name": "Cash and cash equivalents", "amount": 600, "source_field": "Cash and cash equivalents", "description": "Illustrative source balance for cash and bank deposits."},
      {"name": "Accounts receivable", "amount": 250, "source_field": "Trade receivables", "description": "Illustrative source balance for amounts due from customers."},
      {"name": "Inventory", "amount": 150, "source_field": "Inventories", "description": "Illustrative source balance for manufacturing inventories."}
    ],
    "non_current": [
      {"name": "Fixed assets", "amount": 1000, "source_field": "Property, plant and equipment", "description": "Illustrative source balance for operating fixed assets."}
    ]
  },
  "liabilities": {
    "current": [
      {"name": "Accounts payable", "amount": 300, "source_field": "Trade payables", "description": "Illustrative source balance owed to suppliers."},
      {"name": "Short-term borrowings", "amount": 200, "source_field": "Short-term borrowings", "description": "Illustrative source balance for debt due within one year."}
    ],
    "non_current": [
      {"name": "Long-term borrowings", "amount": 500, "source_field": "Long-term borrowings", "description": "Illustrative source balance for debt due after one year."}
    ]
  },
  "equity": {
    "items": [
      {"name": "Share capital", "amount": 600, "source_field": "Share capital", "description": "Illustrative issued share capital."},
      {"name": "Retained earnings", "amount": 400, "source_field": "Retained earnings", "description": "Illustrative cumulative retained profit."}
    ]
  }
}
